{
  "_readme": "Pi's remote procedure call (RPC) transport uses JSON Lines (JSONL) envelopes with a top-level type. Extension UI requests also carry a method. These tables keep the Go provider and TypeScript plugin consistent. The role and stop reason tables hold the values that either reader compares. The unread table states each reader exception.\n\nLeapMux supplements retain partial results beside native frames. Native Pi reports fullOutputPath directly in result details. The browser shows that path beside the original preview. Codemode keeps its status header before its output. MCP results keep their native structured content inline. LeapMux reads no output file.\n\nGenerated structs use the same table keys as the decoders. Native result keys and LeapMux supplement keys keep separate ownership. Go-only RPC command names stay in providers/pi/protocol.go. The shared pi_message_content_conformance fixture checks resolution in both languages.\n\nnotificationEvents lists the events that the Worker persists as notifications. The browser threads them as one notification row. entryTypes holds the session entries that both readers display. The custom role can carry extension text.",
  "events": {
    "EntryAppended": "entry_appended",
    "AgentStart": "agent_start",
    "AgentEnd": "agent_end",
    "AgentSettled": "agent_settled",
    "TurnStart": "turn_start",
    "TurnEnd": "turn_end",
    "MessageStart": "message_start",
    "MessageUpdate": "message_update",
    "MessageEnd": "message_end",
    "ToolExecutionStart": "tool_execution_start",
    "ToolExecutionEnd": "tool_execution_end",
    "ToolExecutionUpdate": "tool_execution_update",
    "ExtensionUIRequest": "extension_ui_request",
    "ExtensionUIResponse": "extension_ui_response",
    "ExtensionError": "extension_error",
    "CompactionStart": "compaction_start",
    "CompactionEnd": "compaction_end",
    "AutoRetryStart": "auto_retry_start",
    "AutoRetryEnd": "auto_retry_end",
    "QueueUpdate": "queue_update",
    "BashExecutionUpdate": "bash_execution_update",
    "SessionInfoChanged": "session_info_changed",
    "ThinkingLevelChanged": "thinking_level_changed",
    "SummarizationRetryScheduled": "summarization_retry_scheduled",
    "SummarizationRetryAttemptStart": "summarization_retry_attempt_start",
    "SummarizationRetryFinished": "summarization_retry_finished",
    "Response": "response"
  },
  "assistantEvents": {
    "TextDelta": "text_delta",
    "ThinkingDelta": "thinking_delta"
  },
  "customTypes": {
    "SubagentNotification": "subagent-notification"
  },
  "dialogMethods": {
    "Select": "select",
    "Confirm": "confirm",
    "Input": "input",
    "Editor": "editor"
  },
  "extensionMethods": {
    "Notify": "notify",
    "SetStatus": "setStatus",
    "SetWidget": "setWidget",
    "SetTitle": "setTitle",
    "SetEditorText": "set_editor_text"
  },
  "toolNames": {
    "AskUserQuestion": "ask_user_question",
    "PlanComplete": "plan_mode_complete",
    "Agent": "Agent",
    "SubagentWorkflow": "SubagentWorkflow",
    "Todo": "todo",
    "Bash": "bash",
    "Read": "read",
    "Edit": "edit",
    "Write": "write",
    "PlanQuestion": "plan_mode_question",
    "GoalQuestion": "goal_question",
    "GoalQuestionnaire": "goal_questionnaire",
    "Codemode": "codemode"
  },
  "planDialogs": {
    "ReadyTitle": "Proposed plan ready. What next?"
  },
  "planActions": {
    "ImplementHere": "Implement here",
    "ImplementFresh": "Start fresh and implement",
    "Stay": "Stay in Plan mode"
  },
  "supplement": {
    "ToolCallID": "toolCallId",
    "ToolName": "toolName",
    "PartialResult": "partialResult"
  },
  "resultFields": {
    "ToolCallID": "toolCallId",
    "ToolName": "toolName",
    "Result": "result"
  },
  "structs": {
    "PiIncompleteToolSupplement": {
      "doc": "PiIncompleteToolSupplement retains the last partial result when a turn ends before the tool result.",
      "table": "supplement",
      "fields": [
        {
          "key": "ToolCallID",
          "type": "string"
        },
        {
          "key": "ToolName",
          "type": "string"
        },
        {
          "key": "PartialResult",
          "type": "json.RawMessage",
          "omitempty": true
        }
      ]
    },
    "PiToolCallIdentity": {
      "doc": "PiToolCallIdentity keeps both native call identity fields consistent across decoders. Each decoder uses a different Go type for the result.",
      "table": "resultFields",
      "fields": [
        {
          "key": "ToolCallID",
          "type": "string"
        },
        {
          "key": "ToolName",
          "type": "string"
        }
      ]
    }
  },
  "roles": {
    "Assistant": "assistant",
    "Custom": "custom"
  },
  "stopReasons": {
    "Error": "error",
    "Aborted": "aborted",
    "Stop": "stop",
    "Length": "length"
  },
  "_unread": {
    "stopReasons": {
      "Stop": {
        "sides": [
          "ts"
        ],
        "why": "The worker uses this reason as native completion evidence. The browser treats every ordinary completion through its default branch and does not compare this reason."
      }
    }
  },
  "notificationEvents": [
    "CompactionEnd",
    "AutoRetryStart",
    "AutoRetryEnd",
    "ExtensionError",
    "SummarizationRetryScheduled",
    "SummarizationRetryAttemptStart",
    "SummarizationRetryFinished"
  ],
  "entryTypes": {
    "CustomMessage": "custom_message",
    "Compaction": "compaction"
  }
}
